{
  "schema_version": "pom-batch/0.1",
  "tree_algorithm": "sha256-domain-separated-duplicate-last",
  "ordering": "occurred_at-asc,receipt_id-asc",
  "batch_ref": "pom-f6cefd038694ca4a747fca86",
  "leaf_count": 3,
  "merkle_root": "f6cefd038694ca4a747fca863a9257c4e1df6c04cf4037973d97199b673e376f",
  "leaves": [
    {
      "receipt_id": "01JZ8K7M6A5P4R3T2V1W0X9Y8Z",
      "commitment_hash": "de204c0c9594c457f8c2243ae4a9d6e4e98f2fd7d53f4ab7797635e1d90a476c",
      "occurred_at": "2026-07-27T10:15:30.000Z",
      "leaf_index": 0,
      "leaf_hash": "b34b397c317de5e0e5892ea0fb4fe15e076dac7643461019eba17b7fb2bf2ab3",
      "proof": [
        {
          "position": "right",
          "hash": "0b8091c4634d7c531dcccc34e98c4449a3adb60871a832d44eeb9c937209b00b"
        },
        {
          "position": "right",
          "hash": "bce24cee014de117f5fcf6cc95db885a2292dfd4eb9de3e972fa81159fac69f0"
        }
      ]
    },
    {
      "receipt_id": "01JZ8K7M6A5P4R3T2V1W0X9Y90",
      "commitment_hash": "2715b4050047a3952dc20e6d59e66768f763acac60c928509b0219333f2e634e",
      "occurred_at": "2026-07-27T10:16:30.000Z",
      "leaf_index": 1,
      "leaf_hash": "0b8091c4634d7c531dcccc34e98c4449a3adb60871a832d44eeb9c937209b00b",
      "proof": [
        {
          "position": "left",
          "hash": "b34b397c317de5e0e5892ea0fb4fe15e076dac7643461019eba17b7fb2bf2ab3"
        },
        {
          "position": "right",
          "hash": "bce24cee014de117f5fcf6cc95db885a2292dfd4eb9de3e972fa81159fac69f0"
        }
      ]
    },
    {
      "receipt_id": "01JZ8K7M6A5P4R3T2V1W0X9Y91",
      "commitment_hash": "0d189dfdd39eb1ac7f437f84ca2112f242a105ae1b6f4873987ab176f7e7b15c",
      "occurred_at": "2026-07-27T10:17:30.000Z",
      "leaf_index": 2,
      "leaf_hash": "3b589305bb559e8c02912e7d411e323b36c1664a1836f06b76a2b51347aba317",
      "proof": [
        {
          "position": "right",
          "hash": "3b589305bb559e8c02912e7d411e323b36c1664a1836f06b76a2b51347aba317"
        },
        {
          "position": "left",
          "hash": "221ca08466efac2631d568336c0f6950273b1f917641fe62e244bb3d95d1cd50"
        }
      ]
    }
  ]
}
